{
  "builder_version": "prospective-card-tracking-v1",
  "capture_mode": "NATIVE_PROSPECTIVE",
  "creation_provenance": {
    "provider_calls": 0,
    "source": "CANONICAL_PUBLISHED_PRODUCT",
    "user_specific_data_included": false
  },
  "field_availability": {
    "backend_user_overlay": "EXCLUDED_USER_SPECIFIC_DATA",
    "evaluator_probability": "NOT_EXPOSED_BY_CANONICAL_PRODUCT_V1"
  },
  "lanes": {
    "balanced": {
      "american_odds": -105,
      "away_team": "LAR",
      "book": "FANDUEL",
      "canonical_headline": {
        "american_odds": -105,
        "book": "FANDUEL",
        "ev": -0.03245347725867209,
        "game_id": "2026_04_LAR_PHI",
        "lane": "BALANCED",
        "line": 3.5,
        "market": "SPREAD",
        "market_probability": 0.49541956760718214,
        "matchup": {
          "away_team": "LAR",
          "home_team": "PHI"
        },
        "model_probability": 0.5051648792924172,
        "play_through": {
          "line": 3.5,
          "price_american": -108
        },
        "recommended_units": 0.75,
        "reliability": "MEDIUM",
        "selection": "PHI",
        "state": "BET",
        "support": "SUPPORTED",
        "trust_probability": 0.5051648792924172,
        "value_at": null,
        "warnings": []
      },
      "ev": -0.03245347725867209,
      "exact_offer_identity_id": "offer-40b6727be655c1c04e626197",
      "game_id": "2026_04_LAR_PHI",
      "home_team": "PHI",
      "kickoff_at_utc": "2026-10-04T17:00:00Z",
      "lane": "BALANCED",
      "lane_key": "balanced",
      "line": 3.5,
      "logical_recommendation_id": "logical-8098e400a29de10d99c15884",
      "market": "SPREAD",
      "market_probability": 0.49541956760718214,
      "model_probability": 0.5051648792924172,
      "normalized_selection": "PHI",
      "normalized_side": "home",
      "play_through": {
        "line": 3.5,
        "price_american": -108
      },
      "portfolio_duplicate_of_lane": null,
      "portfolio_stake_suppressed_reason": null,
      "recommended_units": 0.75,
      "reliability": "MEDIUM",
      "roof_state": {
        "status": "AVAILABLE",
        "support": "SUPPORTED"
      },
      "selection": "PHI",
      "selector_version": "balanced-price-bounded-v2",
      "state": "BET",
      "support": "SUPPORTED",
      "trust_probability": 0.5051648792924172,
      "value_at": null,
      "wager_identity_id": "wager-b86a0adc52eb26295a999740",
      "warnings": []
    },
    "hit_rate": {
      "american_odds": -180,
      "away_team": "NYJ",
      "book": "FANDUEL",
      "canonical_headline": {
        "american_odds": -180,
        "book": "FANDUEL",
        "ev": -0.008031621896816943,
        "game_id": "2026_04_NYJ_CHI",
        "lane": "HIT_RATE",
        "line": null,
        "market": "MONEYLINE",
        "market_probability": 0.6383787519747235,
        "matchup": {
          "away_team": "NYJ",
          "home_team": "CHI"
        },
        "model_probability": 0.6872592609872625,
        "play_through": {
          "line": null,
          "price_american": -185
        },
        "recommended_units": 1.0,
        "reliability": "MEDIUM",
        "selection": "CHI",
        "state": "BET",
        "support": "SUPPORTED",
        "trust_probability": 0.662819006480993,
        "value_at": null,
        "warnings": []
      },
      "ev": -0.008031621896816943,
      "exact_offer_identity_id": "offer-2b60cad06a056e0531d6ac5b",
      "game_id": "2026_04_NYJ_CHI",
      "home_team": "CHI",
      "kickoff_at_utc": "2026-10-04T17:00:00Z",
      "lane": "HIT_RATE",
      "lane_key": "hit_rate",
      "line": null,
      "logical_recommendation_id": "logical-227b86a64a8fc999620d8f1f",
      "market": "MONEYLINE",
      "market_probability": 0.6383787519747235,
      "model_probability": 0.6872592609872625,
      "normalized_selection": "CHI",
      "normalized_side": "home",
      "play_through": {
        "line": null,
        "price_american": -185
      },
      "portfolio_duplicate_of_lane": null,
      "portfolio_stake_suppressed_reason": null,
      "recommended_units": 1.0,
      "reliability": "MEDIUM",
      "roof_state": {
        "status": "AVAILABLE",
        "support": "SUPPORTED"
      },
      "selection": "CHI",
      "selector_version": "v1",
      "state": "BET",
      "support": "SUPPORTED",
      "trust_probability": 0.662819006480993,
      "value_at": null,
      "wager_identity_id": "wager-4591c40e99a46cc160939c46",
      "warnings": []
    },
    "value": {
      "american_odds": -105,
      "away_team": "LAC",
      "book": "DRAFTKINGS",
      "canonical_headline": {
        "american_odds": -105,
        "book": "DRAFTKINGS",
        "ev": 0.0031333867273671823,
        "game_id": "2026_04_LAC_SEA",
        "lane": "VALUE",
        "line": 7.0,
        "market": "SPREAD",
        "market_probability": 0.47184039298487523,
        "matchup": {
          "away_team": "LAC",
          "home_team": "SEA"
        },
        "model_probability": 0.5045107354495264,
        "play_through": null,
        "recommended_units": 0.75,
        "reliability": "MEDIUM",
        "selection": "LAC",
        "state": "BET",
        "support": "SUPPORTED",
        "trust_probability": 0.5045107354495264,
        "value_at": null,
        "warnings": []
      },
      "ev": 0.0031333867273671823,
      "exact_offer_identity_id": "offer-59d7fafca540f4c77dd1783c",
      "game_id": "2026_04_LAC_SEA",
      "home_team": "SEA",
      "kickoff_at_utc": "2026-10-04T20:25:00Z",
      "lane": "VALUE",
      "lane_key": "value",
      "line": 7.0,
      "logical_recommendation_id": "logical-24bc9fe16c3f5785ba7dc534",
      "market": "SPREAD",
      "market_probability": 0.47184039298487523,
      "model_probability": 0.5045107354495264,
      "normalized_selection": "LAC",
      "normalized_side": "away",
      "play_through": null,
      "portfolio_duplicate_of_lane": null,
      "portfolio_stake_suppressed_reason": null,
      "recommended_units": 0.75,
      "reliability": "MEDIUM",
      "roof_state": {
        "status": "AVAILABLE",
        "support": "SUPPORTED"
      },
      "selection": "LAC",
      "selector_version": "v1",
      "state": "BET",
      "support": "SUPPORTED",
      "trust_probability": 0.5045107354495264,
      "value_at": null,
      "wager_identity_id": "wager-1eb1d1b7372266ca91f77d08",
      "warnings": []
    }
  },
  "product_freshness": {
    "age_seconds": 0.0,
    "observed_at_utc": "2026-10-04T00:08:36Z",
    "state": "FRESH",
    "threshold_seconds": 43200.0
  },
  "product_generated_at_utc": "2026-10-04T00:08:36Z",
  "product_stale": false,
  "product_warnings": [
    "1 canonical Week 4 game(s) lack a provider event."
  ],
  "publication_id": "publication-1067fb98d5ff139db0f80c89",
  "published_at_utc": "2026-10-04T00:08:36.364589Z",
  "schema_version": "NFL_EDGE_PROSPECTIVE_CARD_PUBLICATION_V1",
  "season": 2026,
  "source_commit_sha": null,
  "source_product_sha256": "1067fb98d5ff139db0f80c892ddc350a867c96fbb0cd8eb4286dced91f937d44",
  "source_product_version": "live-2026-week4-product-v1",
  "source_provenance": {
    "evaluator_versions": {
      "moneyline": "ml_v4",
      "spread": "spread_v3",
      "total": "total_v3"
    },
    "football_data_version": "live-2026-state:60467f76b5f4389b92cfac87",
    "market_snapshot_version": "live-market:571bfe6895114bba5eea8438",
    "model_versions": {
      "expected_margin": "expected-margin-v1-stable",
      "qb_elo": "qb-elo-v1.0.0",
      "ridge_totals_r4": "ridge-totals-r4-alpha100",
      "xgboost_v2": "post-v5-v2-conservative-adaptive-tail"
    },
    "prediction_as_of_utc": "2026-10-04T00:05:05.316907Z",
    "qb_snapshot_version": "sleeper-scheduled-20261004T000002Z-62945d90",
    "selector_versions": {
      "balanced": "balanced-price-bounded-v2",
      "hit_rate": "v1",
      "value": "v1"
    }
  },
  "source_week_last_kickoff_at_utc": "2026-10-06T00:15:00Z",
  "week": 4
}
