{
  "builder_version": "prospective-card-tracking-v1",
  "capture_mode": "NATIVE_PROSPECTIVE",
  "creation_provenance": {
    "provider_calls": 0,
    "source": "CANONICAL_PUBLISHED_PRODUCT",
    "user_specific_data_included": false
  },
  "field_availability": {
    "backend_user_overlay": "EXCLUDED_USER_SPECIFIC_DATA",
    "evaluator_probability": "NOT_EXPOSED_BY_CANONICAL_PRODUCT_V1"
  },
  "lanes": {
    "balanced": {
      "american_odds": 100,
      "away_team": "BUF",
      "book": "FANDUEL",
      "canonical_headline": {
        "american_odds": 100,
        "book": "FANDUEL",
        "ev": -0.04427390791027158,
        "game_id": "2026_05_BUF_LAR",
        "lane": "BALANCED",
        "line": 2.5,
        "market": "SPREAD",
        "market_probability": 0.5,
        "matchup": {
          "away_team": "BUF",
          "home_team": "LAR"
        },
        "model_probability": 0.5045672974717863,
        "play_through": {
          "line": 2.5,
          "price_american": -103
        },
        "recommended_units": 0.75,
        "reliability": "MEDIUM",
        "selection": "BUF",
        "state": "BET",
        "support": "SUPPORTED",
        "trust_probability": 0.5045672974717863,
        "value_at": null,
        "warnings": []
      },
      "ev": -0.04427390791027158,
      "exact_offer_identity_id": "offer-b5483b4407af19862fe1759d",
      "game_id": "2026_05_BUF_LAR",
      "home_team": "LAR",
      "kickoff_at_utc": "2026-10-13T00:15:00Z",
      "lane": "BALANCED",
      "lane_key": "balanced",
      "line": 2.5,
      "logical_recommendation_id": "logical-6045a93da11ac45a11624c1e",
      "market": "SPREAD",
      "market_probability": 0.5,
      "model_probability": 0.5045672974717863,
      "normalized_selection": "BUF",
      "normalized_side": "away",
      "play_through": {
        "line": 2.5,
        "price_american": -103
      },
      "portfolio_duplicate_of_lane": null,
      "portfolio_stake_suppressed_reason": null,
      "recommended_units": 0.75,
      "reliability": "MEDIUM",
      "roof_state": {
        "status": "AVAILABLE",
        "support": "SUPPORTED"
      },
      "selection": "BUF",
      "selector_version": "balanced-price-bounded-v2",
      "state": "BET",
      "support": "SUPPORTED",
      "trust_probability": 0.5045672974717863,
      "value_at": null,
      "wager_identity_id": "wager-83c3f7cbc66a238d5f36ab4a",
      "warnings": []
    },
    "hit_rate": {
      "american_odds": -285,
      "away_team": "PHI",
      "book": "DRAFTKINGS",
      "canonical_headline": {
        "american_odds": -285,
        "book": "DRAFTKINGS",
        "ev": -0.012068556573441969,
        "game_id": "2026_05_PHI_JAX",
        "lane": "HIT_RATE",
        "line": null,
        "market": "MONEYLINE",
        "market_probability": 0.7247075017205782,
        "matchup": {
          "away_team": "PHI",
          "home_team": "JAX"
        },
        "model_probability": 0.6950817635813422,
        "play_through": {
          "line": null,
          "price_american": -296
        },
        "recommended_units": 0.5,
        "reliability": "MEDIUM",
        "selection": "JAX",
        "state": "BET",
        "support": "SUPPORTED",
        "trust_probability": 0.6950817635813422,
        "value_at": null,
        "warnings": []
      },
      "ev": -0.012068556573441969,
      "exact_offer_identity_id": "offer-aff711f5b7d7348d567b535e",
      "game_id": "2026_05_PHI_JAX",
      "home_team": "JAX",
      "kickoff_at_utc": "2026-10-11T13:30:00Z",
      "lane": "HIT_RATE",
      "lane_key": "hit_rate",
      "line": null,
      "logical_recommendation_id": "logical-56daf356de6e741e7fe6ff56",
      "market": "MONEYLINE",
      "market_probability": 0.7247075017205782,
      "model_probability": 0.6950817635813422,
      "normalized_selection": "JAX",
      "normalized_side": "home",
      "play_through": {
        "line": null,
        "price_american": -296
      },
      "portfolio_duplicate_of_lane": null,
      "portfolio_stake_suppressed_reason": null,
      "recommended_units": 0.5,
      "reliability": "MEDIUM",
      "roof_state": {
        "status": "AVAILABLE",
        "support": "SUPPORTED"
      },
      "selection": "JAX",
      "selector_version": "v1",
      "state": "BET",
      "support": "SUPPORTED",
      "trust_probability": 0.6950817635813422,
      "value_at": null,
      "wager_identity_id": "wager-4145cca25a7a82bad5be22a4",
      "warnings": []
    },
    "value": {
      "american_odds": 176,
      "away_team": "LV",
      "book": "FANDUEL",
      "canonical_headline": {
        "american_odds": 176,
        "book": "FANDUEL",
        "ev": 0.007691167107896413,
        "game_id": "2026_05_LV_NE",
        "lane": "VALUE",
        "line": null,
        "market": "MONEYLINE",
        "market_probability": 0.36417790904312564,
        "matchup": {
          "away_team": "LV",
          "home_team": "NE"
        },
        "model_probability": 0.4647834845275225,
        "play_through": null,
        "recommended_units": 0.0,
        "reliability": "LOW",
        "selection": "LV",
        "state": "TARGET_ONLY",
        "support": "SUPPORTED",
        "trust_probability": 0.4647834845275225,
        "value_at": {
          "line": null,
          "price_american": 184
        },
        "warnings": []
      },
      "ev": 0.007691167107896413,
      "exact_offer_identity_id": "offer-87b63ff928dfe1a8ad4ef0ad",
      "game_id": "2026_05_LV_NE",
      "home_team": "NE",
      "kickoff_at_utc": "2026-10-11T17:00:00Z",
      "lane": "VALUE",
      "lane_key": "value",
      "line": null,
      "logical_recommendation_id": "logical-19389c24ef80eadf98e596fe",
      "market": "MONEYLINE",
      "market_probability": 0.36417790904312564,
      "model_probability": 0.4647834845275225,
      "normalized_selection": "LV",
      "normalized_side": "away",
      "play_through": null,
      "portfolio_duplicate_of_lane": null,
      "portfolio_stake_suppressed_reason": null,
      "recommended_units": 0.0,
      "reliability": "LOW",
      "roof_state": {
        "status": "AVAILABLE",
        "support": "SUPPORTED"
      },
      "selection": "LV",
      "selector_version": "v1",
      "state": "TARGET_ONLY",
      "support": "SUPPORTED",
      "trust_probability": 0.4647834845275225,
      "value_at": {
        "line": null,
        "price_american": 184
      },
      "wager_identity_id": "wager-bb57ccadfc3dafc145f4838a",
      "warnings": []
    }
  },
  "product_freshness": {
    "age_seconds": 0.0,
    "observed_at_utc": "2026-10-06T12:08:44Z",
    "state": "FRESH",
    "threshold_seconds": 43200.0
  },
  "product_generated_at_utc": "2026-10-06T12:08:44Z",
  "product_stale": false,
  "product_warnings": [
    "1 canonical Week 5 game(s) lack a provider event."
  ],
  "publication_id": "publication-1991e91fac419a8c056a0daf",
  "published_at_utc": "2026-10-06T12:08:44.564388Z",
  "schema_version": "NFL_EDGE_PROSPECTIVE_CARD_PUBLICATION_V1",
  "season": 2026,
  "source_commit_sha": null,
  "source_product_sha256": "1991e91fac419a8c056a0daffc4cc76c86f5c46ed06cb9b1cf46792ff99ba6fd",
  "source_product_version": "live-2026-week5-product-v1",
  "source_provenance": {
    "evaluator_versions": {
      "moneyline": "ml_v4",
      "spread": "spread_v3",
      "total": "total_v3"
    },
    "football_data_version": "live-2026-state:d50aefaacb29395dc519322b",
    "market_snapshot_version": "live-market:cd40abe8e87bc8b2c9b83b3e",
    "model_versions": {
      "expected_margin": "expected-margin-v1-stable",
      "qb_elo": "qb-elo-v1.0.0",
      "ridge_totals_r4": "ridge-totals-r4-alpha100",
      "xgboost_v2": "post-v5-v2-conservative-adaptive-tail"
    },
    "prediction_as_of_utc": "2026-10-06T12:05:06.069037Z",
    "qb_snapshot_version": "sleeper-scheduled-20261006T120001Z-5754e81d",
    "selector_versions": {
      "balanced": "balanced-price-bounded-v2",
      "hit_rate": "v1",
      "value": "v1"
    }
  },
  "source_week_last_kickoff_at_utc": "2026-10-13T00:15:00Z",
  "week": 5
}
