{
  "builder_version": "prospective-card-tracking-v1",
  "capture_mode": "NATIVE_PROSPECTIVE",
  "creation_provenance": {
    "provider_calls": 0,
    "source": "CANONICAL_PUBLISHED_PRODUCT",
    "user_specific_data_included": false
  },
  "field_availability": {
    "backend_user_overlay": "EXCLUDED_USER_SPECIFIC_DATA",
    "evaluator_probability": "NOT_EXPOSED_BY_CANONICAL_PRODUCT_V1"
  },
  "lanes": {
    "balanced": {
      "american_odds": -130,
      "away_team": "CLE",
      "book": "DRAFTKINGS",
      "canonical_headline": {
        "american_odds": -130,
        "book": "DRAFTKINGS",
        "ev": -0.0026813654981078794,
        "game_id": "2026_07_CLE_TEN",
        "lane": "BALANCED",
        "line": null,
        "market": "MONEYLINE",
        "market_probability": 0.546045395460454,
        "matchup": {
          "away_team": "CLE",
          "home_team": "TEN"
        },
        "model_probability": 0.7187715678972165,
        "play_through": {
          "line": null,
          "price_american": -133
        },
        "recommended_units": 0.75,
        "reliability": "MEDIUM",
        "selection": "CLE",
        "state": "BET",
        "support": "SUPPORTED",
        "trust_probability": 0.6324084816788353,
        "value_at": null,
        "warnings": []
      },
      "ev": -0.0026813654981078794,
      "exact_offer_identity_id": "offer-9b082b9fa3654619cd0fcbc3",
      "game_id": "2026_07_CLE_TEN",
      "home_team": "TEN",
      "kickoff_at_utc": "2026-10-25T17:00:00Z",
      "lane": "BALANCED",
      "lane_key": "balanced",
      "line": null,
      "logical_recommendation_id": "logical-f861f9852736359c7e09d78a",
      "market": "MONEYLINE",
      "market_probability": 0.546045395460454,
      "model_probability": 0.7187715678972165,
      "normalized_selection": "CLE",
      "normalized_side": "away",
      "play_through": {
        "line": null,
        "price_american": -133
      },
      "portfolio_duplicate_of_lane": null,
      "portfolio_stake_suppressed_reason": null,
      "recommended_units": 0.75,
      "reliability": "MEDIUM",
      "roof_state": {
        "status": "AVAILABLE",
        "support": "SUPPORTED"
      },
      "selection": "CLE",
      "selector_version": "balanced-price-bounded-v2",
      "state": "BET",
      "support": "SUPPORTED",
      "trust_probability": 0.6324084816788353,
      "value_at": null,
      "wager_identity_id": "wager-c8e9ff17fd9fea1a5ade621b",
      "warnings": []
    },
    "hit_rate": {
      "american_odds": -158,
      "away_team": "PIT",
      "book": "FANDUEL",
      "canonical_headline": {
        "american_odds": -158,
        "book": "FANDUEL",
        "ev": -0.004998511555339424,
        "game_id": "2026_07_PIT_NO",
        "lane": "HIT_RATE",
        "line": null,
        "market": "MONEYLINE",
        "market_probability": 0.5883967071736573,
        "matchup": {
          "away_team": "PIT",
          "home_team": "NO"
        },
        "model_probability": 0.704974152846642,
        "play_through": {
          "line": null,
          "price_american": -162
        },
        "recommended_units": 0.75,
        "reliability": "MEDIUM",
        "selection": "PIT",
        "state": "BET",
        "support": "SUPPORTED",
        "trust_probability": 0.6466854300101497,
        "value_at": null,
        "warnings": []
      },
      "ev": -0.004998511555339424,
      "exact_offer_identity_id": "offer-057c3c8911c00b313c40491f",
      "game_id": "2026_07_PIT_NO",
      "home_team": "NO",
      "kickoff_at_utc": "2026-10-25T13:30:00Z",
      "lane": "HIT_RATE",
      "lane_key": "hit_rate",
      "line": null,
      "logical_recommendation_id": "logical-6d7d116f14afdd5ac5303097",
      "market": "MONEYLINE",
      "market_probability": 0.5883967071736573,
      "model_probability": 0.704974152846642,
      "normalized_selection": "PIT",
      "normalized_side": "away",
      "play_through": {
        "line": null,
        "price_american": -162
      },
      "portfolio_duplicate_of_lane": null,
      "portfolio_stake_suppressed_reason": null,
      "recommended_units": 0.75,
      "reliability": "MEDIUM",
      "roof_state": {
        "status": "AVAILABLE",
        "support": "SUPPORTED"
      },
      "selection": "PIT",
      "selector_version": "v1",
      "state": "BET",
      "support": "SUPPORTED",
      "trust_probability": 0.6466854300101497,
      "value_at": null,
      "wager_identity_id": "wager-e3fe012e1567f46802dcd68f",
      "warnings": []
    },
    "value": {
      "american_odds": -120,
      "away_team": "LAR",
      "book": "DRAFTKINGS",
      "canonical_headline": {
        "american_odds": -120,
        "book": "DRAFTKINGS",
        "ev": 0.0016233766233766933,
        "game_id": "2026_07_LAR_LV",
        "lane": "VALUE",
        "line": 3.5,
        "market": "SPREAD",
        "market_probability": 0.537852568752202,
        "matchup": {
          "away_team": "LAR",
          "home_team": "LV"
        },
        "model_probability": 0.5050253276513891,
        "play_through": null,
        "recommended_units": 0.75,
        "reliability": "MEDIUM",
        "selection": "LV",
        "state": "BET",
        "support": "SUPPORTED",
        "trust_probability": 0.5050253276513891,
        "value_at": null,
        "warnings": []
      },
      "ev": 0.0016233766233766933,
      "exact_offer_identity_id": "offer-8a0f9ffa9b68de362c3192b1",
      "game_id": "2026_07_LAR_LV",
      "home_team": "LV",
      "kickoff_at_utc": "2026-10-25T20:25:00Z",
      "lane": "VALUE",
      "lane_key": "value",
      "line": 3.5,
      "logical_recommendation_id": "logical-b25026e464db4d5c4b3f5e29",
      "market": "SPREAD",
      "market_probability": 0.537852568752202,
      "model_probability": 0.5050253276513891,
      "normalized_selection": "LV",
      "normalized_side": "home",
      "play_through": null,
      "portfolio_duplicate_of_lane": null,
      "portfolio_stake_suppressed_reason": null,
      "recommended_units": 0.75,
      "reliability": "MEDIUM",
      "roof_state": {
        "status": "AVAILABLE",
        "support": "SUPPORTED"
      },
      "selection": "LV",
      "selector_version": "v1",
      "state": "BET",
      "support": "SUPPORTED",
      "trust_probability": 0.5050253276513891,
      "value_at": null,
      "wager_identity_id": "wager-ab4e936a0d76cd3806a7bf55",
      "warnings": []
    }
  },
  "product_freshness": {
    "age_seconds": 0.0,
    "observed_at_utc": "2026-10-25T12:08:35Z",
    "state": "FRESH",
    "threshold_seconds": 43200.0
  },
  "product_generated_at_utc": "2026-10-25T12:08:35Z",
  "product_stale": false,
  "product_warnings": [
    "1 canonical Week 7 game(s) lack a provider event."
  ],
  "publication_id": "publication-cc0b5a5a611c59a88a69fab7",
  "published_at_utc": "2026-10-25T12:08:35.629946Z",
  "schema_version": "NFL_EDGE_PROSPECTIVE_CARD_PUBLICATION_V1",
  "season": 2026,
  "source_commit_sha": null,
  "source_product_sha256": "cc0b5a5a611c59a88a69fab770e5fcafe481dcf81e565330bfd22bff02d4c7a9",
  "source_product_version": "live-2026-week7-product-v1",
  "source_provenance": {
    "evaluator_versions": {
      "moneyline": "ml_v4",
      "spread": "spread_v3",
      "total": "total_v3"
    },
    "football_data_version": "live-2026-state:58daacef814a5a856e888661",
    "market_snapshot_version": "live-market:761fc01331b10f8c12736036",
    "model_versions": {
      "expected_margin": "expected-margin-v1-stable",
      "qb_elo": "qb-elo-v1.0.0",
      "ridge_totals_r4": "ridge-totals-r4-alpha100",
      "xgboost_v2": "post-v5-v2-conservative-adaptive-tail"
    },
    "prediction_as_of_utc": "2026-10-25T12:05:04.018440Z",
    "qb_snapshot_version": "sleeper-scheduled-20261025T120001Z-d5c02954",
    "selector_versions": {
      "balanced": "balanced-price-bounded-v2",
      "hit_rate": "v1",
      "value": "v1"
    }
  },
  "source_week_last_kickoff_at_utc": "2026-10-27T00:15:00Z",
  "week": 7
}
